{
  "receiptId": "CTR-R24-WP-301-AUTHORING-SURFACES",
  "missionId": "YALKEN-R2.4-GUIDED-BOOTSTRAP-2026-08-19",
  "contourId": "WP-301_AUTHORING_SURFACES",
  "attemptId": "ATTEMPT-WP301-20260825",
  "authorityEpoch": "R24-WP301-BASE-EBB18772",
  "exactHeadSha": "d714e8cfbea0eba211fe8145a038b7db62f69132",
  "mergeState": "MERGED",
  "postmergeState": "PASS",
  "survivorState": "PASS",
  "evidenceStampIds": [
    "ES-R24-WP-301-AUTHORING-SURFACES-MODEL",
    "ES-R24-WP-301-AUTHORING-SURFACES-CONTRACT",
    "ES-R24-WP-301-AUTHORING-SURFACES-INTEGRATION",
    "ES-R24-WP-301-AUTHORING-SURFACES-MUTANTS",
    "ES-R24-WP-301-AUTHORING-SURFACES-EXACT-HEAD",
    "ES-R24-WP-301-AUTHORING-SURFACES-POSTMERGE-EXACT-HEAD",
    "ES-R24-WP-301-AUTHORING-SURFACES-SURVIVOR-AUDIT",
    "ES-R24-WP-301-AUTHORING-SURFACES-CLAIM-BINDINGS"
  ],
  "nextContourId": null,
  "schemaVersion": "ContourTerminalReceiptV2"
}
