{
  "receiptId": "CTR-R24-WP-207-WRITER-REFINEMENT",
  "missionId": "YALKEN-R2.4-GUIDED-BOOTSTRAP-2026-08-19",
  "contourId": "WP-207_WRITER_REFINEMENT",
  "attemptId": "ATTEMPT-WP207-20260825",
  "authorityEpoch": "R24-WP207-BASE-2C7C4E8",
  "exactHeadSha": "e952207aa5ef91d954ca3ee3c5068b9fa7beed1f",
  "mergeState": "MERGED",
  "postmergeState": "PASS",
  "survivorState": "PASS",
  "evidenceStampIds": [
    "ES-R24-WP-207-WRITER-REFINEMENT-MODEL",
    "ES-R24-WP-207-WRITER-REFINEMENT-CONTRACT",
    "ES-R24-WP-207-WRITER-REFINEMENT-INTEGRATION",
    "ES-R24-WP-207-WRITER-REFINEMENT-MUTANTS",
    "ES-R24-WP-207-WRITER-REFINEMENT-EXACT-HEAD",
    "ES-R24-WP-207-WRITER-REFINEMENT-POSTMERGE-EXACT-HEAD",
    "ES-R24-WP-207-WRITER-REFINEMENT-SURVIVOR-AUDIT",
    "ES-R24-WP-207-WRITER-REFINEMENT-CLAIM-BINDINGS"
  ],
  "nextContourId": null,
  "schemaVersion": "ContourTerminalReceiptV2"
}
