{
  "receiptId": "CTR-R24-WP-303-DESIGN-OS-CUSTOMIZATION",
  "missionId": "YALKEN-R2.4-GUIDED-BOOTSTRAP-2026-08-19",
  "contourId": "WP-303_DESIGN_OS_CUSTOMIZATION",
  "attemptId": "ATTEMPT-WP303-20260826",
  "authorityEpoch": "R24-WP303-BASE-4EBFB78E",
  "exactHeadSha": "aacaf1f6c15cfcd89925c248b1e90105c64bde43",
  "mergeState": "MERGED",
  "postmergeState": "PASS",
  "survivorState": "PASS",
  "evidenceStampIds": [
    "ES-R24-WP-303-DESIGN-OS-CUSTOMIZATION-MODEL",
    "ES-R24-WP-303-DESIGN-OS-CUSTOMIZATION-CONTRACT",
    "ES-R24-WP-303-DESIGN-OS-CUSTOMIZATION-INTEGRATION",
    "ES-R24-WP-303-DESIGN-OS-CUSTOMIZATION-MUTANTS",
    "ES-R24-WP-303-DESIGN-OS-CUSTOMIZATION-EXACT-HEAD",
    "ES-R24-WP-303-DESIGN-OS-CUSTOMIZATION-POSTMERGE-EXACT-HEAD",
    "ES-R24-WP-303-DESIGN-OS-CUSTOMIZATION-SURVIVOR-AUDIT",
    "ES-R24-WP-303-DESIGN-OS-CUSTOMIZATION-CLAIM-BINDINGS"
  ],
  "nextContourId": null,
  "schemaVersion": "ContourTerminalReceiptV2"
}
